[
  {
    "id": "evidence.system.profile",
    "collectorId": "fedora.system-profile",
    "kind": "system_profile",
    "collectedAt": "2026-07-18T10:00:00Z",
    "data": {
      "osName": "Fedora Linux",
      "osVersion": "44",
      "architecture": "x86_64",
      "desktop": "KDE Plasma 6.4",
      "hostname": "fixture-workstation"
    }
  },
  {
    "id": "evidence.storage.root",
    "collectorId": "common.disk-usage",
    "kind": "disk_usage",
    "collectedAt": "2026-07-18T10:00:00Z",
    "data": { "mount": "/", "usedPercent": 94, "availableBytes": 8589934592 }
  },
  {
    "id": "evidence.services.failed",
    "collectorId": "fedora.failed-units",
    "kind": "failed_services",
    "collectedAt": "2026-07-18T10:00:00Z",
    "data": {
      "failedCount": 2,
      "units": ["example-a.service", "example-b.service"]
    }
  },
  {
    "id": "evidence.network.state",
    "collectorId": "fedora.network-state",
    "kind": "network_state",
    "collectedAt": "2026-07-18T10:00:00Z",
    "data": {
      "connected": false,
      "dnsServers": ["192.0.2.53"],
      "ssid": "Fixture WiFi"
    }
  },
  {
    "id": "evidence.updates.state",
    "collectorId": "fedora.update-state",
    "kind": "update_state",
    "collectedAt": "2026-07-18T10:00:00Z",
    "data": { "pendingCount": 17, "rebootPending": false }
  }
]
